<?xml version = "1.0"?>
<!DOCTYPE pageLayout SYSTEM "pageLayout.dtd">
<pageLayout>
  <dimension>
    <!-- in cm -->
    <page_height>297</page_height>
    <page_width>210</page_width>
  </dimension>
  <margin>
    <!-- in cm -->
    <top_margin>16.5</top_margin>
    <left_margin>4.55</left_margin>
    <bottom_margin>6</bottom_margin>
    <right_margin>4.55</right_margin>
  </margin>
  <label>
    <!-- in cm -->
    <label_height>34</label_height>
    <label_width>99.1</label_width>
    <qrcode>
      <!-- in cm -->
      <qr_size>34</qr_size>
      <qr_x>0</qr_x>
      <qr_y>0</qr_y>
    </qrcode>
    <text>
      <!-- in pt -->
      <text_size>250</text_size>
      <!-- in cm -->
      <text_x>39</text_x>
      <text_y>0</text_y>
    </text>
  </label>
  <labelGap>
    <!-- in cm -->
    <horizontal_gap>3.4</horizontal_gap>
    <vertical_gap>0</vertical_gap>
  </labelGap>
  <rows>16</rows>
  <columns>2</columns>
</pageLayout>
